{
  "schema_version": "1.0.0",
  "scenario_id": "SITL-FAULT-018",
  "title": "wrong XRCE client key",
  "status": "BLOCKED",
  "requirement_ids": [
    "BBF-DDS-009"
  ],
  "audit_ids": [
    "BBF-AUD-001",
    "BBF-AUD-014",
    "BBF-AUD-018"
  ],
  "milestone": "M3",
  "profile": {
    "profile_id": "sitl-dds-baseline-v1",
    "environment": "SITL",
    "transport": "UDP",
    "ros_domain_isolated": true,
    "namespace": "/"
  },
  "preconditions": [
    "expected client key frozen in profile",
    "transport identity guard active"
  ],
  "forbidden_conditions": [
    "unknown client accepted",
    "identity inferred only from topic discovery"
  ],
  "participants": [
    {
      "participant_id": "px4_sitl",
      "role": "authoritative_px4",
      "required": true,
      "expected_count": {
        "min": 1,
        "max": 1
      }
    },
    {
      "participant_id": "dds_agent",
      "role": "single_udp_transport",
      "required": true,
      "expected_count": {
        "min": 1,
        "max": 1
      }
    },
    {
      "participant_id": "transport_guard",
      "role": "client_identity_guard",
      "required": true,
      "expected_count": {
        "min": 1,
        "max": 1
      }
    },
    {
      "participant_id": "fault_injector",
      "role": "approved_profile_mutator",
      "required": true,
      "expected_count": {
        "min": 1,
        "max": 1
      }
    }
  ],
  "source_identity": {
    "profile_ref": "sitl-dds-baseline-v1",
    "bindings": [
      {
        "source": "px4_sitl",
        "identity_kind": "profile_identity",
        "expected": "expected-xrce-client-key",
        "mock": false
      },
      {
        "source": "dds_agent",
        "identity_kind": "profile_identity",
        "expected": "xrce-agent-binary-and-command-hash",
        "mock": false
      }
    ]
  },
  "initial_state": "WAIT_INPUTS",
  "stimuli": [
    {
      "at": "0s",
      "action": "present_wrong_client_key",
      "source": "fault_injector",
      "target": "transport_guard",
      "payload_class": "invalid_transport_identity",
      "correlation_id": "fault-018-key",
      "stimulus_id": "present_wrong_client_key"
    }
  ],
  "expected_events": [
    {
      "event_type": "client_identity_rejected",
      "source": "transport_guard",
      "target": "dds_session",
      "earliest": "0s",
      "deadline": "500ms",
      "count": {
        "min": 1,
        "max": 1
      },
      "order_after": [],
      "order_before": [
        "fault_latched"
      ],
      "correlation_id": "fault-018-key",
      "event_id": "client_identity_rejected"
    },
    {
      "event_type": "fault_latched",
      "source": "transport_guard",
      "target": "authority_state",
      "earliest": "0s",
      "deadline": "750ms",
      "count": {
        "min": 1,
        "max": 1
      },
      "order_after": [
        "client_identity_rejected"
      ],
      "order_before": [],
      "correlation_id": "fault-018-key",
      "event_id": "fault_latched"
    }
  ],
  "forbidden_events": [
    {
      "event_type": "dds_session_authorized",
      "source": "transport_guard",
      "target": "px4_sitl",
      "count": {
        "min": 0,
        "max": 0
      },
      "correlation_id": "fault-018-key",
      "event_id": "forbidden-dds_session_authorized",
      "earliest": "0s",
      "deadline": "750ms",
      "order_after": [],
      "order_before": []
    },
    {
      "event_type": "state_entered",
      "source": "transport_guard",
      "target": "PRESTREAM",
      "count": {
        "min": 0,
        "max": 0
      },
      "correlation_id": "fault-018-key",
      "event_id": "forbidden-state_entered",
      "earliest": "0s",
      "deadline": "750ms",
      "order_after": [],
      "order_before": []
    }
  ],
  "timeouts": [
    {
      "timeout_id": "client_key_validation",
      "duration": "750ms",
      "starts_at": "scenario_started",
      "on_expiry": "fail_closed_and_emit_fault"
    }
  ],
  "cleanup": {
    "actions": [
      "reject and close wrong-key session",
      "invalidate discovered endpoints",
      "verify all managed participants absent"
    ],
    "deadline": "2s",
    "expected_absent_participants": [
      "px4_sitl",
      "dds_agent",
      "transport_guard",
      "fault_injector"
    ]
  },
  "evidence": {
    "required_artifacts": [
      "raw JSONL timeline",
      "expected/observed hashed client identities",
      "session rejection",
      "cleanup participant inventory"
    ],
    "synthetic_fixture_allowed": false,
    "acceptance_level": "FORMAL_SITL"
  },
  "dependencies": [
    "BLOCKED_BY_T00",
    "BLOCKED_BY_T01",
    "BLOCKED_BY_T04",
    "BLOCKED_BY_T05",
    "BLOCKED_BY_T06",
    "BLOCKED_BY_T08"
  ],
  "limitations": [
    "Offline specification only.",
    "Evidence stores identity references or hashes, not credentials."
  ],
  "fault_injection": {
    "at": "0s",
    "duration": "750ms",
    "expected_fault_code": "XRCE_CLIENT_KEY_MISMATCH",
    "detection_deadline": "750ms",
    "expected_state": "FAULT_LATCHED",
    "forbidden_states": [
      "PRESTREAM",
      "ACTIVE"
    ],
    "automatic_recovery": false,
    "reset_conditions": [
      "wrong-key session absent",
      "new profile-matching session",
      "approved operator reset"
    ],
    "cleanup": [
      "close invalid session",
      "invalidate endpoints"
    ],
    "unimplemented_dependencies": [
      "BLOCKED_BY_T04",
      "BLOCKED_BY_T05",
      "BLOCKED_BY_T06",
      "BLOCKED_BY_T08"
    ],
    "injection_point": "XRCE client identity handshake"
  },
  "assertions": {
    "state_transitions": [
      {
        "from": "WAIT_INPUTS",
        "to": "FAULT_LATCHED",
        "trigger": "client_identity_rejected",
        "deadline": "750ms"
      }
    ],
    "endpoint_contracts": [
      {
        "topic": "/fmu/out/vehicle_status_v1",
        "message_type": "px4_msgs/msg/VehicleStatus",
        "direction": "publisher",
        "qos": {
          "reliability": "best_effort",
          "durability": "volatile",
          "history": "keep_last",
          "depth": 1
        },
        "publisher_count": {
          "min": 0,
          "max": 0
        },
        "required_source": "px4_sitl"
      }
    ],
    "participant_cardinality": [
      {
        "participant_id": "px4_sitl",
        "count": {
          "min": 0,
          "max": 0
        }
      }
    ]
  }
}
