{
  "schema_version": "1.0.0",
  "scenario_id": "SITL-NORMAL-007",
  "title": "Receive rc_channels from the authoritative PX4 publisher",
  "status": "BLOCKED",
  "requirement_ids": ["BBF-DDS-005", "BBF-SAFE-004"],
  "audit_ids": ["BBF-AUD-005", "BBF-AUD-012"],
  "milestone": "M1",
  "profile": {"profile_id": "sitl_dds_rc_channels_v1", "environment": "SITL", "transport": "UDP", "ros_domain_isolated": true, "namespace": "/"},
  "preconditions": ["T02 provides a locked endpoint manifest and PX4 artifact that exports rc_channels", "the authoritative PX4 identity is attestable independently of payload content"],
  "forbidden_conditions": ["mock, replay, or hand-written publisher is present", "more than one rc_channels publisher is present"],
  "participants": [
    {"participant_id": "px4_sitl", "role": "authoritative_px4", "required": true, "expected_count": {"min": 1, "max": 1}},
    {"participant_id": "offboard_control_node", "role": "rc_consumer", "required": true, "expected_count": {"min": 1, "max": 1}}
  ],
  "source_identity": {"profile_ref": "sitl_dds_rc_channels_v1", "bindings": [{"source": "px4_sitl", "identity_kind": "locked_process_artifact", "expected": "profile.px4_sitl_identity", "mock": false}]},
  "initial_state": "WAIT_INPUTS",
  "stimuli": [
    {"stimulus_id": "N007-S01", "at": "0ms", "action": "BEGIN_RC_OBSERVATION", "source": "acceptance_runner", "target": "offboard_control_node", "payload_class": "observation_window", "correlation_id": "normal-007-rc"}
  ],
  "expected_events": [
    {"event_id": "N007-E01", "event_type": "PX4_FEEDBACK_RECEIVED", "source": "px4_sitl", "target": "offboard_control_node", "earliest": "0ms", "deadline": "1000ms", "count": {"min": 1, "max": 50}, "order_after": [], "order_before": ["N007-E02"], "correlation_id": "normal-007-rc"},
    {"event_id": "N007-E02", "event_type": "RC_SOURCE_IDENTITY_CONFIRMED", "source": "acceptance_runner", "target": "acceptance_runner", "earliest": "0ms", "deadline": "1500ms", "count": {"min": 1, "max": 1}, "order_after": ["N007-E01"], "order_before": ["N007-E03"], "correlation_id": "normal-007-rc"},
    {"event_id": "N007-E03", "event_type": "STATE_TRANSITION", "source": "offboard_control_node", "target": "offboard_control_node", "earliest": "0ms", "deadline": "1600ms", "count": {"min": 1, "max": 1}, "order_after": ["N007-E02"], "order_before": [], "correlation_id": "normal-007-rc"}
  ],
  "forbidden_events": [
    {"event_id": "N007-F01", "event_type": "MOCK_SOURCE_ACCEPTED", "source": "*", "target": "*", "earliest": "0ms", "deadline": "1600ms", "count": {"min": 0, "max": 0}, "order_after": [], "order_before": [], "correlation_id": "normal-007-rc"},
    {"event_id": "N007-F02", "event_type": "DUPLICATE_PUBLISHER_DETECTED", "source": "*", "target": "/fmu/out/rc_channels", "earliest": "0ms", "deadline": "1600ms", "count": {"min": 0, "max": 0}, "order_after": [], "order_before": [], "correlation_id": "normal-007-rc"}
  ],
  "timeouts": [
    {"timeout_id": "first_rc", "duration": "1s", "starts_at": "N007-S01", "on_expiry": "FAIL_CLOSED"},
    {"timeout_id": "rc_identity", "duration": "500ms", "starts_at": "N007-E01", "on_expiry": "FAIL_CLOSED"}
  ],
  "cleanup": {"actions": ["END_RC_OBSERVATION", "CLEAR_SCENARIO_RC_CACHE"], "deadline": "2s", "expected_absent_participants": []},
  "evidence": {"required_artifacts": ["timeline.jsonl", "endpoint_contract.json", "source_identity.json", "px4_profile_hash.txt"], "synthetic_fixture_allowed": false, "acceptance_level": "FORMAL_SITL"},
  "dependencies": ["BLOCKED_BY_T00", "BLOCKED_BY_T01", "BLOCKED_BY_T02", "BLOCKED_BY_T05", "BLOCKED_BY_T08"],
  "limitations": ["Parser unit tests and synthetic RC payloads cannot close this PX4 contract gate.", "No formal SITL run was performed in this wave."],
  "assertions": {
    "endpoint_contracts": [{"topic": "/fmu/out/rc_channels", "message_type": "px4_msgs/msg/RcChannels", "direction": "publisher", "qos": {"reliability": "best_effort", "durability": "volatile", "history": "keep_last", "depth": 1}, "publisher_count": {"min": 1, "max": 1}, "required_source": "px4_sitl"}],
    "state_transitions": [{"from": "WAIT_INPUTS", "to": "RC_READY", "trigger": "N007-E02", "deadline": "1600ms"}],
    "participant_cardinality": [{"participant_id": "px4_sitl", "count": {"min": 1, "max": 1}}]
  }
}
