{
  "schema_version": "1.0.0",
  "scenario_id": "SITL-FAULT-013",
  "title": "PX4 restart",
  "status": "BLOCKED",
  "requirement_ids": [
    "BBF-SAFE-004",
    "BBF-SAFE-007",
    "BBF-DDS-009"
  ],
  "audit_ids": [
    "BBF-AUD-004",
    "BBF-AUD-007",
    "BBF-AUD-014",
    "BBF-AUD-018"
  ],
  "milestone": "M3",
  "profile": {
    "profile_id": "sitl-dds-baseline-v1",
    "environment": "SITL",
    "transport": "UDP",
    "ros_domain_isolated": true,
    "namespace": "/"
  },
  "preconditions": [
    "PX4 feedback epoch established",
    "authority state is ACTIVE"
  ],
  "forbidden_conditions": [
    "old feedback cache accepted in new PX4 epoch",
    "automatic replay of old command"
  ],
  "participants": [
    {
      "participant_id": "px4_sitl",
      "role": "authoritative_px4",
      "required": true,
      "expected_count": {
        "min": 1,
        "max": 1
      }
    },
    {
      "participant_id": "dds_agent",
      "role": "single_udp_transport",
      "required": true,
      "expected_count": {
        "min": 1,
        "max": 1
      }
    },
    {
      "participant_id": "offboard_control",
      "role": "control_dut",
      "required": true,
      "expected_count": {
        "min": 1,
        "max": 1
      }
    },
    {
      "participant_id": "fault_injector",
      "role": "approved_px4_lifecycle_controller",
      "required": true,
      "expected_count": {
        "min": 1,
        "max": 1
      }
    }
  ],
  "source_identity": {
    "profile_ref": "sitl-dds-baseline-v1",
    "bindings": [
      {
        "source": "px4_sitl",
        "identity_kind": "profile_identity",
        "expected": "px4-sitl-instance-and-boot-epoch",
        "mock": false
      },
      {
        "source": "offboard_control",
        "identity_kind": "profile_identity",
        "expected": "offboard-control-dut",
        "mock": false
      }
    ]
  },
  "initial_state": "ACTIVE",
  "stimuli": [
    {
      "at": "2s",
      "action": "restart_px4_sitl_instance",
      "source": "fault_injector",
      "target": "px4_sitl",
      "payload_class": "bounded_lifecycle_directive",
      "correlation_id": "fault-013-px4",
      "stimulus_id": "restart_px4_sitl_instance"
    }
  ],
  "expected_events": [
    {
      "event_type": "px4_epoch_changed",
      "source": "transport_guard",
      "target": "authority_state",
      "earliest": "2s",
      "deadline": "3s",
      "count": {
        "min": 1,
        "max": 1
      },
      "order_after": [],
      "order_before": [
        "fault_latched"
      ],
      "correlation_id": "fault-013-px4",
      "event_id": "px4_epoch_changed"
    },
    {
      "event_type": "fault_latched",
      "source": "transport_guard",
      "target": "authority_state",
      "earliest": "2s",
      "deadline": "3250ms",
      "count": {
        "min": 1,
        "max": 1
      },
      "order_after": [
        "px4_epoch_changed"
      ],
      "order_before": [],
      "correlation_id": "fault-013-px4",
      "event_id": "fault_latched"
    }
  ],
  "forbidden_events": [
    {
      "event_type": "old_transaction_replayed",
      "source": "offboard_control",
      "target": "px4_sitl",
      "count": {
        "min": 0,
        "max": 0
      },
      "correlation_id": "fault-013-px4",
      "event_id": "forbidden-old_transaction_replayed",
      "earliest": "0s",
      "deadline": "1250ms",
      "order_after": [],
      "order_before": []
    },
    {
      "event_type": "state_entered",
      "source": "transport_guard",
      "target": "ACTIVE",
      "count": {
        "min": 0,
        "max": 0
      },
      "correlation_id": "fault-013-px4",
      "event_id": "forbidden-state_entered",
      "earliest": "0s",
      "deadline": "1250ms",
      "order_after": [],
      "order_before": []
    }
  ],
  "timeouts": [
    {
      "timeout_id": "px4_restart_detection",
      "duration": "1250ms",
      "starts_at": "restart_px4_sitl_instance",
      "on_expiry": "fail_closed_and_emit_fault"
    }
  ],
  "cleanup": {
    "actions": [
      "stop restarted PX4 SITL instance",
      "invalidate feedback caches, lease, PRESTREAM, and pending ACK",
      "verify all managed participants absent"
    ],
    "deadline": "2s",
    "expected_absent_participants": [
      "px4_sitl",
      "dds_agent",
      "offboard_control",
      "fault_injector"
    ]
  },
  "evidence": {
    "required_artifacts": [
      "raw JSONL timeline",
      "old/new PX4 boot epoch identity",
      "cache invalidation events",
      "cleanup participant inventory"
    ],
    "synthetic_fixture_allowed": false,
    "acceptance_level": "FORMAL_SITL"
  },
  "dependencies": [
    "BLOCKED_BY_T00",
    "BLOCKED_BY_T01",
    "BLOCKED_BY_T03",
    "BLOCKED_BY_T04",
    "BLOCKED_BY_T05",
    "BLOCKED_BY_T06",
    "BLOCKED_BY_T08",
    "SAFETY_DECISION_REQUIRED"
  ],
  "limitations": [
    "Offline specification only.",
    "Restart injection is authorized only inside future isolated SITL orchestration."
  ],
  "fault_injection": {
    "at": "2s",
    "duration": "750ms",
    "expected_fault_code": "PX4_RESTARTED",
    "detection_deadline": "1250ms",
    "expected_state": "FAULT_LATCHED",
    "forbidden_states": [
      "ACTIVE"
    ],
    "automatic_recovery": false,
    "reset_conditions": [
      "approved operator reset",
      "new PX4 epoch bound to profile",
      "new owner lease",
      "new PRESTREAM and command correlation"
    ],
    "cleanup": [
      "stop restarted instance",
      "invalidate both PX4 epochs"
    ],
    "unimplemented_dependencies": [
      "BLOCKED_BY_T03",
      "BLOCKED_BY_T04",
      "BLOCKED_BY_T05",
      "BLOCKED_BY_T06",
      "SAFETY_DECISION_REQUIRED"
    ],
    "injection_point": "managed PX4 SITL lifecycle"
  },
  "assertions": {
    "state_transitions": [
      {
        "from": "ACTIVE",
        "to": "FAULT_LATCHED",
        "trigger": "px4_epoch_changed",
        "deadline": "1250ms"
      }
    ],
    "endpoint_contracts": [
      {
        "topic": "/fmu/out/vehicle_status_v1",
        "message_type": "px4_msgs/msg/VehicleStatus",
        "direction": "publisher",
        "qos": {
          "reliability": "best_effort",
          "durability": "volatile",
          "history": "keep_last",
          "depth": 1
        },
        "publisher_count": {
          "min": 1,
          "max": 1
        },
        "required_source": "px4_sitl"
      }
    ],
    "participant_cardinality": [
      {
        "participant_id": "px4_sitl",
        "count": {
          "min": 1,
          "max": 1
        }
      }
    ]
  }
}
