{
  "schema_version": "1.0.0",
  "scenario_id": "SITL-FAULT-005",
  "title": "stale VehicleStatus",
  "status": "BLOCKED",
  "requirement_ids": [
    "BBF-SAFE-004",
    "BBF-SAFE-006"
  ],
  "audit_ids": [
    "BBF-AUD-004",
    "BBF-AUD-006",
    "BBF-AUD-007",
    "BBF-AUD-014"
  ],
  "milestone": "M3",
  "profile": {
    "profile_id": "sitl-dds-baseline-v1",
    "environment": "SITL",
    "transport": "UDP",
    "ros_domain_isolated": true,
    "namespace": "/"
  },
  "preconditions": [
    "fresh VehicleStatus has been received",
    "one state-confirming transaction is pending"
  ],
  "forbidden_conditions": [
    "mock PX4 feedback source",
    "wall-clock-only age calculation"
  ],
  "participants": [
    {
      "participant_id": "px4_sitl",
      "role": "authoritative_px4",
      "required": true,
      "expected_count": {
        "min": 1,
        "max": 1
      }
    },
    {
      "participant_id": "offboard_control",
      "role": "status_consumer",
      "required": true,
      "expected_count": {
        "min": 1,
        "max": 1
      }
    },
    {
      "participant_id": "fault_injector",
      "role": "approved_status_drop_filter",
      "required": true,
      "expected_count": {
        "min": 1,
        "max": 1
      }
    }
  ],
  "source_identity": {
    "profile_ref": "sitl-dds-baseline-v1",
    "bindings": [
      {
        "source": "px4_sitl",
        "identity_kind": "profile_identity",
        "expected": "px4-sitl-instance",
        "mock": false
      },
      {
        "source": "offboard_control",
        "identity_kind": "profile_identity",
        "expected": "offboard-control-dut",
        "mock": false
      }
    ]
  },
  "initial_state": "MODE_PENDING",
  "stimuli": [
    {
      "at": "2s",
      "action": "suppress_status_updates",
      "source": "fault_injector",
      "target": "vehicle_status_observation_path",
      "payload_class": "transport_filter_rule",
      "correlation_id": "fault-005-status",
      "stimulus_id": "suppress_status_updates"
    }
  ],
  "expected_events": [
    {
      "event_type": "input_stale",
      "source": "offboard_control",
      "target": "/fmu/out/vehicle_status_v1",
      "earliest": "2500ms",
      "deadline": "2600ms",
      "count": {
        "min": 1,
        "max": 1
      },
      "order_after": [],
      "order_before": [
        "fault_latched"
      ],
      "correlation_id": "fault-005-status",
      "event_id": "input_stale"
    },
    {
      "event_type": "fault_latched",
      "source": "offboard_control",
      "target": "authority_state",
      "earliest": "2500ms",
      "deadline": "2750ms",
      "count": {
        "min": 1,
        "max": 1
      },
      "order_after": [
        "input_stale"
      ],
      "order_before": [],
      "correlation_id": "fault-005-status",
      "event_id": "fault_latched"
    }
  ],
  "forbidden_events": [
    {
      "event_type": "transaction_succeeded",
      "source": "offboard_control",
      "target": "authority_state",
      "count": {
        "min": 0,
        "max": 0
      },
      "correlation_id": "fault-005-status",
      "event_id": "forbidden-transaction_succeeded",
      "earliest": "0s",
      "deadline": "750ms",
      "order_after": [],
      "order_before": []
    },
    {
      "event_type": "state_entered",
      "source": "offboard_control",
      "target": "ACTIVE",
      "count": {
        "min": 0,
        "max": 0
      },
      "correlation_id": "fault-005-status",
      "event_id": "forbidden-state_entered",
      "earliest": "0s",
      "deadline": "750ms",
      "order_after": [],
      "order_before": []
    }
  ],
  "timeouts": [
    {
      "timeout_id": "vehicle_status_freshness",
      "duration": "500ms",
      "starts_at": "last_fresh_vehicle_status",
      "on_expiry": "fail_closed_and_emit_fault"
    },
    {
      "timeout_id": "fault_detection",
      "duration": "750ms",
      "starts_at": "suppress_status_updates",
      "on_expiry": "fail_closed_and_emit_fault"
    }
  ],
  "cleanup": {
    "actions": [
      "remove status filter",
      "clear stale cache and pending command",
      "revoke active lease",
      "verify participant count is zero after shutdown"
    ],
    "deadline": "2s",
    "expected_absent_participants": [
      "px4_sitl",
      "offboard_control",
      "fault_injector"
    ]
  },
  "evidence": {
    "required_artifacts": [
      "raw JSONL timeline",
      "last fresh receive timestamp",
      "PX4 epoch identity",
      "cleanup participant inventory"
    ],
    "synthetic_fixture_allowed": false,
    "acceptance_level": "FORMAL_SITL"
  },
  "dependencies": [
    "BLOCKED_BY_T00",
    "BLOCKED_BY_T01",
    "BLOCKED_BY_T03",
    "BLOCKED_BY_T05",
    "BLOCKED_BY_T06",
    "BLOCKED_BY_T08",
    "SAFETY_DECISION_REQUIRED"
  ],
  "limitations": [
    "Offline specification only; threshold requires T03 interface freeze.",
    "Final post-fault flight action is SAFETY_DECISION_REQUIRED."
  ],
  "fault_injection": {
    "at": "2s",
    "duration": "1s",
    "expected_fault_code": "VEHICLE_STATUS_STALE",
    "detection_deadline": "750ms",
    "expected_state": "FAULT_LATCHED",
    "forbidden_states": [
      "ACTIVE",
      "TRANSACTION_SUCCEEDED"
    ],
    "automatic_recovery": false,
    "reset_conditions": [
      "approved operator reset",
      "fresh health window from same PX4 epoch",
      "no pending command"
    ],
    "cleanup": [
      "remove filter",
      "invalidate status cache"
    ],
    "unimplemented_dependencies": [
      "BLOCKED_BY_T03",
      "BLOCKED_BY_T05",
      "BLOCKED_BY_T06",
      "SAFETY_DECISION_REQUIRED"
    ],
    "injection_point": "/fmu/out/vehicle_status_v1 observation path"
  },
  "assertions": {
    "state_transitions": [
      {
        "from": "MODE_PENDING",
        "to": "FAULT_LATCHED",
        "trigger": "input_stale",
        "deadline": "750ms"
      }
    ],
    "endpoint_contracts": [
      {
        "topic": "/fmu/out/vehicle_status_v1",
        "message_type": "px4_msgs/msg/VehicleStatus",
        "direction": "publisher",
        "qos": {
          "reliability": "best_effort",
          "durability": "volatile",
          "history": "keep_last",
          "depth": 1
        },
        "publisher_count": {
          "min": 1,
          "max": 1
        },
        "required_source": "px4_sitl"
      }
    ],
    "participant_cardinality": [
      {
        "participant_id": "px4_sitl",
        "count": {
          "min": 1,
          "max": 1
        }
      }
    ]
  }
}
